{
  "title": "Hockey night",
  "setting": "She texts after her team wins in overtime.",
  "startingSmooth": 50,
  "exchanges": [
    {
      "theirMessage": "OT winner!! Power play goal, we finally got the man advantage.",
      "replies": [
        {
          "id": "a",
          "text": "Nice, the power play finally clicked?",
          "smoothDelta": 30,
          "theirResponse": "YES. It had been 0 for 14.",
          "coachNote": "You picked up the term and asked about it."
        },
        {
          "id": "b",
          "text": "Cool, so who won?",
          "smoothDelta": -20,
          "theirResponse": "...We did. It is in my text.",
          "coachNote": "Read her message first."
        }
      ]
    }
  ],
  "closingNote": "A power play is a two-minute man advantage after a penalty."
}
